{
  "$schema": "https://json-schema.org/draft/2020-12/schema",
  "$id": "operation-result-v2.schema.json",
  "title": "Schuss headless operation result v2",
  "type": "object",
  "required": ["schema_version", "canonical_profile", "operation", "status", "value", "diagnostics"],
  "properties": {
    "schema_version": {"const": "schuss-operation-result-v2"},
    "canonical_profile": {"const": "schuss-canonical-json-v1"},
    "operation": {
      "enum": [
        "records.validate", "graph.inspect", "build.resolve", "graph.transact",
        "catalog.search", "catalog.inspect", "invalid-request"
      ]
    },
    "status": {"enum": ["success", "invalid", "unresolved", "unsupported", "ambiguous", "conflict"]},
    "value": {"oneOf": [{"type": "null"}, {"type": "object", "x-schuss-domain-value": true}]},
    "diagnostics": {
      "type": "array", "x-schuss-array-kind": "sequence",
      "items": {"$ref": "#/$defs/diagnostic"}
    }
  },
  "additionalProperties": false,
  "$defs": {
    "diagnostic": {
      "type": "object",
      "required": ["code", "severity", "subject", "location", "message"],
      "properties": {
        "code": {"type": "string", "pattern": "^[A-Z][A-Z0-9_]*$"},
        "severity": {"enum": ["error", "warning", "info"]},
        "subject": {"type": "string", "minLength": 1},
        "location": {"type": "string", "minLength": 1},
        "message": {"type": "string", "minLength": 1}
      },
      "additionalProperties": false
    }
  }
}
