{"canonical_profile":"schuss-canonical-json-v1","diagnostics":[],"operation":"catalog.search","schema_version":"schuss-operation-result-v2","status":"success","value":{"catalog_reference":{"catalog_id":"schuss-catalog-000001","content_hash":"sha256:eac44b08aa2f6b2fdfd938b47094b19af671f3b15de8eb4280c729bd0f42b6b9","revision":2},"filters":{"abstraction":[],"capability":[],"form":[],"function":[],"provenance":[],"readiness":[],"signal_domain":[],"signal_rate":[],"signal_role":[],"technique":[]},"input_closure_hash":"sha256:9688233ff2d3995fe047af61c63fd134f98a6decbdbe9b8a311b50e2faae415e","match_algorithm":"schuss-catalog-match-v1","projection_version":"schuss-catalog-projection-v2","query":"percussion","record_set_reference":{"content_hash":"sha256:1db0091c378d38ed7050a46ea1457a74c40b4301af655dd9d045974572fc5db8","record_set_id":"schuss-record-set-000011","revision":1},"results":[{"abstraction_level":"compound","aliases":["Euclidean Drum and Bell"],"contract_facets_available":true,"description":"An inspectable clocked compound combining sequencer, envelope, drum, bell, crossfade, and VCA components.","display_name":"Dual Percussion Voice","family_reference":{"content_hash":"sha256:c9d444c6f3d3eac041e548845ba852adde7fdd8d8dab42391a4fabed44c1f572","family_id":"schuss-family-000040","revision":1},"implementation_forms":["transparent-compound"],"primary_function":"sound-sources","provenance_facets":["schuss"],"readiness_states":["contracted","bound","eligible","unresolved"],"score":300,"technique_tags":["percussion","reusable-voice","transparent-compound"]},{"abstraction_level":"primitive","aliases":["Braids Struck Bell"],"contract_facets_available":true,"description":"Generates a struck-bell audio voice with pitch, timbre, color, and strike control.","display_name":"Struck Bell Voice","family_reference":{"content_hash":"sha256:af55d92c4b87e0fbd6387283d4a3b8235631e5bc1d0c0e850a92403e085677f0","family_id":"schuss-family-000038","revision":1},"implementation_forms":["native-object"],"primary_function":"sound-sources","provenance_facets":["axoloti-factory"],"readiness_states":["contracted","bound","unresolved"],"score":300,"technique_tags":["feedback-fm","percussion"]},{"abstraction_level":"primitive","aliases":["Braids Struck Drum"],"contract_facets_available":true,"description":"Generates a struck-drum audio voice with pitch, timbre, color, and strike control.","display_name":"Struck Drum Voice","family_reference":{"content_hash":"sha256:f2d6b946ed234e9aa0dbcd5d63410897df2ef0b0f72cb17956e446f3f95a7f29","family_id":"schuss-family-000037","revision":1},"implementation_forms":["native-object"],"primary_function":"sound-sources","provenance_facets":["axoloti-factory"],"readiness_states":["contracted","bound","unresolved"],"score":300,"technique_tags":["percussion","physical-modeling"]}],"total_matches":3}}
